{
  "schemaVersion": 1,
  "id": "feed-ai-operations",
  "title": "Mein KI-Betriebs-Podcast — synthetisches Beispiel",
  "topicIDs": [
    "ai-operations"
  ],
  "sourceEpisodeIDs": [
    "episode-1",
    "episode-2",
    "episode-3",
    "episode-4"
  ],
  "profileRevision": 1,
  "policyRevision": 1,
  "learningEnabled": false,
  "unheardFilter": "unheardSegments",
  "editionMode": "allUnheard",
  "activeListeningBudgetMs": 0,
  "publicationPolicy": "whenNewSegments",
  "notificationsEnabled": false,
  "privacy": "privateInApp"
}
